,0
262,"ΔThe Democratic Republic of the Congo (DRC) is now under new management. In April, President Felix Tshisekedi ousted the last remaining elements of his government who were loyal to former leader Joseph Kabila in the culmination of a long campaign to take full control of the country. It was a secret power-sharing deal with Kabila that initially brought Tshisekedi to power, naming him the winner of the rigged 2018 elections over Martin Fayulu, who was widely-acknowledged as the true victor of the popular vote. Now, more than two years into his tenure, Tshisekedi has thrown off the vestiges of the Kabila “puppet master” and is poised to pursue his own political agenda.  Tshisekedi seems poised to make regional integration a cornerstone of his independent administration, throwing off the country’s moniker as “Africa’s problem child” to build closer political and economic ties with other states in the region. Not only have such efforts gained traction on the continent in recent years, but Tshisekedi is also keen to distance himself from the foreign policy of his predecessor, emphasizing his own multilateral ambitions in contrast to Kabila’s “brinksmanship” approach to diplomacy. But while Tshisekedi has touted regional cooperation as a key priority, his wholesale campaign to discredit political opponents suggests that he has not fully set aside the authoritarian tactics favored by Kabila.Tshisekedi’s ties to “the Congo strongman” have hurt him from the start of his administration. He initially campaigned against endemic political issues, with promises to curb rampant corruption, raising average wages, and resolve instability in eastern DRC. This reform-minded agenda was explicitly presented as a foil to Kabila, who has been widely-condemned in the country as a leader willing to ignore crises to secure his own political power. But the power-sharing deal that brought him into office unexpectedly put Tshisekedi in the position of working with Kabila, not against him. The perceived power struggle between the two men sparked national outrage the new president spent his first two years in office on political squabbling rather than fulfilling his campaign commitments. Now, fully in control of his government and with an eye towards the 2023 reelection cycle, Tshisekedi is in desperate need of an image overhaul.The bureaucratic cycles of regional institutions seem perfectly aligned to give Tshisekedi the multilateral legitimacy he so desperately needs. In February, the DRC took over the rotating chairship of the African Union (AU), giving Tshisekedi a full year at the helm of the continent’s largest institution. The country is also poised to ascend to the East African Community (EAC) after years of delay, with regional partners optimistic about the prospects of building ties with Tshisekedi independent of Kabila’s influence.Tshisekedi has wasted no time in outlining ambitious plans for the DRC’s forthcoming institutional engagement. His agenda for the AU chairship prioritizes regional integration, enhancing economic ties and calling on African partners to help curb insecurity in the eastern DRC. He has also committed to investing in AU-U.S. relations, seeking to rebuild ties after previous AU leaders distanced themselves from the Trump Administration amid his travel ban on many African countries.Commentary on the DRC’s likely ascension to the EAC has tended to focus on the economic advantages of the move, which is anticipated to jumpstart Tshisekedi’s development agenda and bring renewed revenue flows to African businesses struggling with the economic fallout of Covid-19. Growing trade relations with the East African bloc may also deepen political integration in the region, limiting China’s influence in the DRC; Beijing currently supplies nearly a third of the country’s total imports. Particularly with other regional leaders speaking out against China’s so-called “debt-trap diplomacy,” Tshisekedi’s adoption of African trading partners in lieu of Beijing will certainly come as a welcome signal of cooperation. Shared institutional interests through the EAC may also present a forum for unifying economic bonds or deeper security cooperation to address rebel activity in the DRC’s Ituri and Kivu provinces.Tshisekedi’s campaign to build ties with other African powers has been extensively covered in recent weeks, with reporting of the “new” DRC emerging under his leadership. Just a few months into his independent rule, Tshisekedi is already reaping the benefits of his modernizing agenda that presents him as an engaged, issue-focused leader – a reputation he hopes will cement his stake in the DRC’s 2023 elections. But as a leader that himself came to power through a backroom deal, Tshisekedi knows better than most that popularity alone is not a guarantee of security.Mere weeks after ousting pro-Kabila elements from his government, Tshisekedi took the unprecedented step of declaring a “state of siege” in eastern DRC, effectively imposing martial law on the Kivu and Ituri provinces that have faced rebel violence and insecurity for decades. While particular attention to these regions is certainly warranted, commentators agree that Tshisekedi’s move was a political message more than anything else. According to Africanist Phil Clark, the real message is that “whenever the opposition rules the provincial government, you get mass violence, you get this mass insecurity.”The reform-minded leader with ambitions for regional integration is only one side of Tshisekedi. Beyond the modernizing face is a fundamentally insecure president who fears being supplanted by a wildcard candidate, just as he cut a deal to edge out Fayulu in 2018. The reliance on Kabila-esque tactics to suppress opposition voices in Eastern DRC represents the other side of the “new” DRC. Janus is now in charge."
263,"Currently you have JavaScript disabled. In order to post comments, please make sure JavaScript and Cookies are enabled, and reload the page. Click here for instructions on how to enable JavaScript in your browser.Δcharged.affairs@ypfp.orgCharged Affairs is a publication of Young Professionals in Foreign Policy, a non-partisan, non-profit organization. Views of the authors do not necessarily represent the views of the organization or the views of their employers. All rights reserved.© 2019 Charged Affairs. All Rights Reserved.The IMF Press Center is a password-protected site for working journalists.The IMF Press Center is a password-protected site for working journalists. Sign up to receive free e-mail notices when new series and/or country items are posted on the IMF website.  Modify your profile May 28, 2021"
264,"Washington, DC:"
265,"In response to a request from the authorities, an International Monetary"
266,"Fund (IMF) mission led by Mauricio Villafuerte, Mission Chief for the"
267,"Democratic Republic of the Congo, held virtual meetings during May 6–27 to"
268,discuss IMF support to the authorities’ economic reform program.
269,"At the end of the mission, Mr. Villafuerte issued the following statement:"
270,“IMF staff completed policy discussions with the authorities on a
271,medium-term program that could be supported by IMF resources of about
272,US$1.5 billion over three years under an Extended Credit Facility (ECF).
273,“The economy of the Democratic Republic of the Congo has been severely
274,impacted by the COVID-19 pandemic. GDP is estimated to have grown by only
275,1.7 percent in 2020 despite the expansion of the extractive sector by
276,almost 10 percent and is projected to expand by 4.9 percent in 2021. The
277,impact of the pandemic on both revenue and spending negatively affected the
278,"public finances, inflation peaked at 15.7 percent year-on-year in August"
279,2020 in parallel with a quick depreciation of the Congolese franc. The
280,Stability Pact signed between the Central Bank of Congo (BCC) and the
281,"central government, the disbursement under the Rapid Credit Facility (RCF)"
282,in April 2020 (see
283,IMF Press Release No. 20/182
284,"), and additional support from other development partners helped stabilize"
285,"the economic and financial situation and close financing gaps, but"
286,substantial fiscal and external financing needs remain over the
287,medium-term.
288,“The authorities’ medium-term program is centered on supporting the
289,post-COVID-19 recovery and revitalizing the reform agenda to raise and
290,"sustain inclusive growth and reduce poverty, in line with the government’s"
291,priorities stated in the 2019-23 National Strategic Development Plan.
292,"Specifically, the program aims at building fiscal space for much needed"
293,"social spending and investment, enhancing the monetary framework and"
294,"financial supervision, and improving economic governance and transparency."
295,IMF financial support is also expected to catalyze financial support from
296,other development partners and help foster private sector investment.
297,“Fiscal policy under the program is geared towards increasing domestic
298,revenue mobilization. Ambitious medium-term revenue targets will be
299,supported by a comprehensive revenue strategy based on both tax
300,"administration and policy measures, including reestablishing the proper"
301,functioning of the VAT and rationalizing tax expenditures and non-tax
302,"revenues. This should pave the way for increases in social spending,"
303,"notably in the health and education sectors, as well as to scale up public"
304,"investment, while preserving debt sustainability. The composition of"
305,expenditures will be enhanced by limiting non-priority spending and
306,improved budgeting of wage and pension outlays.
307,“The authorities aim at strengthening and modernizing the monetary policy
308,and regulatory and supervisory frameworks to maintain low and stable
309,"inflation, strengthen financial sector stability, and foster financial"
310,inclusion. They commit to reinforce central bank autonomy by bringing its
311,Board composition in compliance with the 2018 Central Bank Law and by
312,"regularizing the outstanding credit to the government. In addition, the"
313,authorities will revise the reserve requirement framework and discontinue
314,the provision of advances and guarantees of the BCC to the government.
315,"“Improving governance and fighting against corruption are critical, with"
316,"continued emphasis on the management of extractive resources, on improving"
317,"public financial management, and on fighting money laundering. We welcome"
318,"the authorities’ commitment to reinforce key anti-corruption institutions,"
319,including the Cour des Comptes and the Inspection Générale des Finances.
320,The authorities acknowledge the importance of improving the business
321,climate and attracting private investment to foster high and inclusive
322,economic growth.
323,"“The mission met with Prime Minister Jean-Michel Sama Lukonde Kyenge,"
324,"Minister of Finance Nicolas Kazadi, Minister of Budget Aimé Boji, Minister"
325,"of Health Jean Jacques Mbungani Mbanda, Minister of Public Enterprises"
326,"Adèle Kahinda Mayina, BCC Governor Deogratias Mutombo Mwana Nyembo, other"
327,"senior officials, development partners, the private sector and civil"
328,society organizations representatives. The mission thanks the Congolese
329,authorities for their cooperation and constructive discussions.”
330,"PRESS OFFICER: Meera LouisPhone: +1 202 623-7100Email: MEDIA@IMF.org@IMFSpokesperson© 2021 International Monetary Fund. All rights reserved.Naughty, not nice!XID: 30232806Varnish cache server"
331,RW COVID-19 page: Find latest updates on global humanitarian responses
332,"Find help on how to use the site, read terms and conditions, view the FAQs and API documentation.Access your account or create a new one for additional features or to post job or training opportunities.Latest humanitarian reports, maps and infographics and full document archive.List of countries covered by ReliefWeb.List of alerts, ongoing and past disasters covered by ReliefWeb.List of organizations that are actively providing ReliefWeb with content.Curated pages dedicated to humanitarian themes and specific humanitarian crises.Open job opportunities in the humanitarian field.Open training opportunities in the humanitarian field."
333,DR Congo
334,"SC/14483The following Security Council press statement was issued today by Council President Linda Thomas-Greenfield (United States):The members of the Security Council met on 30 March 2021 to discuss the situation in the Democratic Republic of Congo and activities of the United Nations Organization Stabilization Mission in the Democratic Republic of the Congo (MONUSCO). They were briefed by the Special Representative of the Secretary-General Bintou Keita.The members of the Security Council welcomed the efforts of President Tshisekedi towards reconciliation and peace and stability in the Democratic Republic of the Congo. They further welcomed the steps he has taken to fight corruption and impunity, and encouraged further action to ensure the Government of the Democratic Republic of the Congo respects human rights and fundamental freedoms.The members of the Security Council took note of the efforts towards forming a Government to deliver on President Tshisekedi’s commitments to pursue national unity, strengthen the rule of law, and further political inclusiveness and peacebuilding. They further took note of President Tshisekedi’s intention for that Government to be composed of 30 per cent of women.The members of the Security Council noted that political stability and security, as well as increased State presence in areas of conflict are critical for the consolidation of sustainable peace in the Democratic Republic of the Congo. They encouraged the Government of the Democratic Republic of the Congo to pursue its efforts in this regard, including by developing and implementing a national disarmament, demobilization and reintegration framework, a security sector reform plan and a comprehensive stabilization and conflict prevention strategy.The members of the Security Council recalled the importance of the Democratic Republic of the Congo and its neighbours working together to tackle insecurity in eastern Democratic Republic of the Congo with further political commitment and more integrated approaches, including through economic cooperation and integration, and encouraged further efforts to foster sustainable economic development as a driver for regional peace and to address the root causes of conflict, including the illicit exploitation and trafficking of natural resources, as well as through poverty reduction. They welcomed steps taken by the Democratic Republic of the Congo and the region in that regard. They further welcomed the United Nations Strategy for Peace Consolidation, Conflict Prevention and Conflict Resolution in the Great Lakes Region and looked forward to an inclusive articulation of an action plan for its operationalization and implementation.The members of the Security Council expressed concern at the continuing intercommunal violence and at the increase of armed group activity in the eastern provinces of the Democratic Republic of the Congo, particularly by the Allied Democratic Forces in North Kivu and Ituri, and numerous local armed groups in South Kivu. They reiterated their condemnation of all armed groups operating in the country, called on all actors to end violence and their violations and abuse of international human rights and international humanitarian law.The members of the Security Council further expressed concern at the current humanitarian situation, marked by a significant increase in the number of people in need of protection and humanitarian assistance. They called on the Government of the Democratic Republic of Congo to address the underlying drivers of the current humanitarian situation and on partners to step up their support to the Government of the Democratic Republic of the Congo in tackling these challenges.The members of the Security Council reaffirmed their strong commitment to the sovereignty, independence, unity and territorial integrity of the Democratic Republic of the Congo.The members of the Security Council reiterated their continued support and commitment, in collaboration with regional actors and international partners, for the consolidation of peace, stability and development in the Democratic Republic of the Congo. They further reiterated their full support to MONUSCO and to the new Special Representative of the Secretary-General Bintou Keita and encouraged the Government of the Democratic Republic of the Congo to engage on the development of a detailed transition plan for the progressive and phased drawdown of the Mission.For information media. Not an official record."
335,DR Congo
336,DR Congo
337,+ 3 more
338,DR Congo
339,+ 3 more
340,DR Congo
341,"ReliefWeb's blogReliefWeb Labs projects explore new and emerging opportunities to improve information delivery to humanitarians.Learn more about ReliefWeb, leading online source for reliable and timely humanitarian information on global crises and disasters since 1996.ReliefWeb's terms & Conditions.Contact us.Service provided by UN OCHAOCHA coordinates the global emergency response to save lives and protect people in humanitarian crises. We advocate for effective and principled humanitarian action by all, for all.ReliefWeb's Terms & Conditions.© 2021 all rights reserved.Please select your experienceCopy/paste the script below"
342,OTHER WIDGETS
343,"The Democratic Republic of Congo has rejoined a key trade partnership with the United States that will grant it duty free access to US markets.  It follows a proclamation issued by outgoing US President Donald Trump on Tuesday night.  Washington suspended DR Congo from the  African Growth and Opportunity Act (AGOA) some 10 years ago because of alleged human rights violations under former president Joseph Kabila.The decision affirms President Tshisekedi’s efforts to reform and strengthen the DRC’s democratic institutions, protect human rights, and fight corruption.Since its enactment in 2000, AGOA has been at the core of US economic policy and commercial engagement with Africa.It provides eligible Sub-Saharan African countries with duty-free access to the US market for over 1,800 products. That adds up to more than 5,000 products eligible for duty-free access under the Generalized System of Preferences program.DR Congo's main exports, copper and cobalt, are included in the agreement but are already tariff-free under the System of Preferences.  The announcement comes during a turbulent period in the DRC's politics. President Tshisekedi, who has been in office since January 2019, ended a coalition in December which was dominated by supporters of his powerful predecessor Joseph Kabila, who ruled for 18 years. The move prompted abrawl in parliament with ministers overturning desks and throwing chairs.“It is recognition of President Tshisekedi’s commitment to bringing about the change the Congolese people desire and deserve,” Mike Hammer, the US ambassador to Congo, said in a statement.  “The return of DRC to AGOA is a significant achievement that is a clear manifestation of our Privileged Partnership for Peace and Prosperity,"" said Mike Hammer, the US ambassador to Congo. The United States established the US-DRC Privileged Partnership for Peace and Prosperity in 2019 to combat corruption, protect human rights, strengthen democratic institutions.The partnership seeks to confront potential pandemics, promote peace and security, build a stronger bilateral relationship, and deliver results for the U.S. and Congolese people.''The reinstatement of AGOA eligibility is another landmark achievement showing the progress made toward our shared goals.''"
344,"You are using an outdated browser. Most of this website should still work, but after upgrading your browser it will look and perform better."
345,"Many governments are falling behind on their commitments under the African Union’s anti-corruption conventionTranslations:Image: GovernmentZA / FlickrWhen the African Union Convention on Preventing and Combatting Corruption (AUCPCC) was adopted by the African Union Assembly in 2003, it was a huge step towards resolving the continent’s serious corruption challenges. Designed as a shared roadmap for member states to implement governance and anti-corruption measures, the convention aims to eradicate corruption in government and business. Today, 44 of the 55 member states have ratified the convention, yet there is little information on how well it is implemented in practice. A new report by Transparency International explores this, looking at three important areas: money laundering, illicit enrichment and political party funding, as well as the role civil society and media play in fighting corruption.Money laundering facilitates heinous crimes that damage the lives of millions of Africans across the continent. When criminals make money through arms sales, poaching or corruption, they need to make the cash appear clean before they can use it. Under the AUCPCC, countries are meant to make money laundering illegal. Most countries have done so, but the convention does not give them a framework for how to prevent it, nor does it equip authorities with the tools they need to investigate and prosecute money launderers. Another problem is a lack of data on how effective the tools in place actually are. Based on what data there is, it seems that most countries could be doing a lot more.To effectively track and prosecute money laundering, African governments need to dedicate more resources to specialist skills, such as financial analysts and tax inspectors, and improve cooperation between these experts and prosecutors. Just as important is ensuring complete independence of authorities and courts to prevent well-connected money launderers from escaping prosecutions and convictions. The Mozambican courts stood up against high-level corruption in 2020: a former transport minister was put on trial for money laundering in connection with the national airline’s purchase of two Embraer planes. Embraer admitted to paying bribes to Mozambican officials to secure the deal. The courts also prosecuted a middleman for laundering the bribe payments through a shell company. In order to increase transparency and monitoring, disaggregated data on cases like this should be published annually, specifying the charges and outcomes."
346,Externally hosted content may include ads. These aren't endorsed by or reflect Transparency International's views.
