,0
0,Help us continue to fight human rights abuses. Please give now to support our workAllegedly Embezzled Millions Helped Deprive Congolese of Their Rights@thfessy
1,"Authorities in the Democratic Republic of Congo confirmed last week that they had opened an inquiry following allegations of high-level corruption reported by a consortium of media and international groups. Investigators from 18 countries, working with 19 media outlets and 5 nongovernmental organizations, spent months going through 3.5 million leaked documents to produce “Congo Hold-Up,” a stunning account of corruption under former president Joseph Kabila.The documents, obtained by Mediapart and the Platform to Protect Whistleblowers in Africa, are from BGFIBank Group (Banque Gabonaise et Française Internationale), a private bank allegedly used to channel millions of dollars’ worth of public funds to Kabila’s family and associates.Since November 19, “Congo Hold-Up” findings have been published almost daily, exposing a kleptocratic system that enabled the siphoning of state funds from Congo’s Central Bank, state-owned mining company Gecamines, the national electoral commission, and tax revenues.Kabila, his family, and close associates allegedly embezzled at least US$138 million dollars over five years between 2013 and 2018. They even allegedly stole United Nations payments intended for Congolese soldiers who contributed to peacekeeping operations in the Central African Republic.The trove of material also revealed evidence of fraud and bribery in Congo’s 2008 multi-billion dollar “deal of the century” with two Chinese state-owned mining companies. Sicomines, the joint venture formed to implement part of that deal, denied the allegations. Gecamines has not responded to the allegations.BGFI, in a statement released on November 24, decried the leak and questioned the authenticity of the documents, but “strongly condemn[ed] acts contrary to law and ethics that may have been committed in the past” within its Congo branch “and of which its employees could possibly have been perpetrators or complicit.”Although endemic corruption in Congo is common knowledge, the government’s lack of political will to investigate alleged wrongdoings and the opacity of financial operations have long enabled corrupt officials to enjoy impunity. However, with bank statements, contracts, emails, and transaction records on hand, “Congo Hold-Up” could provide sufficient evidence for prosecutions.Those responsible for financial crimes, as well as their international enablers, should be held accountable. In a country where one in three people is critically hungry and the government constantly neglects basic rights such as access to running water, electricity, health care, and education, justice for large-scale corruption is long overdue.  European Development Banks’ Link to Abuses in the Democratic Republic of Congo's Palm Oil IndustryThe Impact of Lead Contamination on Children’s Rights in Kabwe, Zambia"
2,"Human Rights Watch defends the rights of people in 90 countries worldwide, spotlighting abuses and bringing perpetrators to justice"
3,Get updates on human rights issues from around the globe. Join our movement today.Human Rights Watch  is a 501(C)(3) nonprofit registered in the US under EIN: 13-2875808Please select your experienceCopy/paste the script below
4,OTHER WIDGETS
5,By Africanews
